<?xml version="1.0" encoding="UTF-8"?>
<!DOCTYPE comentarios SYSTEM "../dtd/comentarios.dtd">
<comentarios>
<coment><nombre>Victoria</nombre><calificacion>5</calificacion><desta>no</desta><texto>-¡Diles que no me maten, Justino! Anda, vete a decirles eso. Que por caridad. Así diles. Diles que lo hagan por caridad. -No puedo. Hay allí un sargento que no quiere oír hablar nada de ti. -Haz que te oiga. Date tus mañas y dile que para sustos ya ha estado bueno. Dile que lo haga por caridad de Dios.</texto></coment><coment><nombre>Hayde</nombre><calificacion>5</calificacion><desta>si</desta><texto>Prueba el 04/05/2018, parece que todo funciona bien :D</texto></coment></comentarios>
